{
  "analysis_model_information": "Deterministic WorkOverCV rubric analysis; no LLM model used.",
  "confidence_and_uncertainty_notes": {
    "authorship_bounds": "Authorship interpretation is bounded to collected public repository evidence and should be verified through discussion when it materially affects interpretation.",
    "confidence_summary": "Signal confidence distribution: high=3, medium=5, low=0; evidence gaps recorded: 3.",
    "cross_repository_consistency": "Signals are drawn from 3 repository record(s); cross-repository confidence depends on how many repositories contain matching artifact types.",
    "evidence_density": "698 artifact(s) and 8 behaviour signal(s) were selected for analysis.",
    "private_work_limitations": "Private and company work may be absent from the corpus and should be treated as unknown.",
    "public_repository_limitations": "GitHub evidence is a sample of public work, not a complete employment history."
  },
  "engineering_habits": [
    {
      "caveats": "Public documentation does not directly prove workplace team handoff behavior. Repository artifacts show documented boundaries but do not prove how these decisions were negotiated in a team.",
      "confidence": "medium",
      "description": "Documentation and design-boundary evidence point to a habit of moving context out of private assumptions and into artifacts that reviewers can inspect.",
      "evidence_ids": [
        "ev-001-documentation-reviewer-context-01",
        "ev-001-documentation-reviewer-context-02",
        "ev-001-documentation-reviewer-context-03",
        "ev-001-documentation-reviewer-context-04",
        "ev-001-documentation-reviewer-context-05",
        "ev-002-architecture-explicit-boundaries-01",
        "ev-002-architecture-explicit-boundaries-02",
        "ev-002-architecture-explicit-boundaries-03",
        "ev-002-architecture-explicit-boundaries-04"
      ],
      "habit_id": "externalising_context_and_boundaries",
      "label": "Externalising context and boundaries",
      "supporting_signal_ids": [
        "sig-001-documentation-reviewer-context",
        "sig-002-architecture-explicit-boundaries"
      ]
    },
    {
      "caveats": "Static source inspection does not prove production runtime reliability or operational ownership.",
      "confidence": "high",
      "description": "Implementation evidence shows ideas being converted into code surfaces that can be inspected, run, or traced by another technical reader.",
      "evidence_ids": [
        "ev-003-implementation-inspectable-runtime-01",
        "ev-003-implementation-inspectable-runtime-02",
        "ev-003-implementation-inspectable-runtime-03",
        "ev-003-implementation-inspectable-runtime-04",
        "ev-003-implementation-inspectable-runtime-05"
      ],
      "habit_id": "building_inspectable_runnable_artifacts",
      "label": "Building inspectable runnable artifacts",
      "supporting_signal_ids": [
        "sig-003-implementation-inspectable-runtime"
      ]
    },
    {
      "caveats": "Repository tests show public validation behavior, not the full reliability practices used in private or deployed systems. Metric artifacts need domain review before being treated as proof of model or system quality.",
      "confidence": "medium",
      "description": "Validation and measurement evidence shows technical claims being surrounded by checks, benchmark context, manifests, or reproducibility records.",
      "evidence_ids": [
        "ev-004-testing-validation-gates-01",
        "ev-004-testing-validation-gates-02",
        "ev-004-testing-validation-gates-03",
        "ev-004-testing-validation-gates-04",
        "ev-005-evaluation-measurement-artifacts-01",
        "ev-005-evaluation-measurement-artifacts-02",
        "ev-005-evaluation-measurement-artifacts-03",
        "ev-005-evaluation-measurement-artifacts-04",
        "ev-005-evaluation-measurement-artifacts-05"
      ],
      "habit_id": "validating_claims_through_records",
      "label": "Validating claims through tests, manifests, metrics, or run records",
      "supporting_signal_ids": [
        "sig-004-testing-validation-gates",
        "sig-005-evaluation-measurement-artifacts"
      ]
    },
    {
      "caveats": "Repository artifacts show documented boundaries but do not prove how these decisions were negotiated in a team. Repository tests show public validation behavior, not the full reliability practices used in private or deployed systems.",
      "confidence": "medium",
      "description": "Project structure, configuration, boundaries, and checks create surfaces for later modification and focused technical review.",
      "evidence_ids": [
        "ev-002-architecture-explicit-boundaries-01",
        "ev-002-architecture-explicit-boundaries-02",
        "ev-002-architecture-explicit-boundaries-03",
        "ev-002-architecture-explicit-boundaries-04",
        "ev-004-testing-validation-gates-01",
        "ev-004-testing-validation-gates-02",
        "ev-004-testing-validation-gates-03",
        "ev-004-testing-validation-gates-04",
        "ev-006-maintainability-project-structure-01",
        "ev-006-maintainability-project-structure-02",
        "ev-006-maintainability-project-structure-03",
        "ev-006-maintainability-project-structure-04"
      ],
      "habit_id": "structuring_for_modification_and_review",
      "label": "Structuring work for modification and review",
      "supporting_signal_ids": [
        "sig-002-architecture-explicit-boundaries",
        "sig-004-testing-validation-gates",
        "sig-006-maintainability-project-structure"
      ]
    },
    {
      "caveats": "Public documentation does not directly prove workplace team handoff behavior. Public packaging does not by itself prove user adoption or product-market fit.",
      "confidence": "medium",
      "description": "Packaging and documentation evidence frames the work for readers who need setup context, usage paths, and points to interrogate.",
      "evidence_ids": [
        "ev-001-documentation-reviewer-context-01",
        "ev-001-documentation-reviewer-context-02",
        "ev-001-documentation-reviewer-context-03",
        "ev-001-documentation-reviewer-context-04",
        "ev-001-documentation-reviewer-context-05",
        "ev-008-product-reviewer-positioning-01",
        "ev-008-product-reviewer-positioning-02",
        "ev-008-product-reviewer-positioning-03",
        "ev-008-product-reviewer-positioning-04"
      ],
      "habit_id": "packaging_for_technical_readers",
      "label": "Packaging work for technical readers",
      "supporting_signal_ids": [
        "sig-001-documentation-reviewer-context",
        "sig-008-product-reviewer-positioning"
      ]
    }
  ],
  "environment_fit": {
    "may_fit_well": [
      "Applied ML, evaluation-heavy, or measurement-oriented teams.",
      "Research-adjacent engineering or ambiguous technical problem spaces.",
      "Tool-building contexts that value documentation, boundaries, and inspectability.",
      "Engineering contexts where runnable artifacts and concrete implementation are important."
    ],
    "may_require_care": [
      "Roles where private/company work, live collaboration, or production operation history is essential should probe beyond public repositories.",
      "Recorded evidence gaps should be handled as interview prompts, not adverse conclusions."
    ]
  },
  "evidence_gaps_and_follow_up_questions": [
    {
      "confidence": "medium",
      "gap_id": "gap-001-collaboration_visibility_gap",
      "label": "Collaboration Visibility Gap",
      "scope": "collected public repository evidence",
      "suggested_follow_up": "Ask for an example of reviewed team work, handoff notes, or pull request discussion.",
      "what_was_observed": "Public repository evidence can show documentation and packaging, but it does not directly show team review, pull-request discussion, or workplace collaboration.",
      "why_uncertain": "The repository corpus is a public evidence sample and does not expose every work context."
    },
    {
      "confidence": "medium",
      "gap_id": "gap-002-private_and_company_work_visibility_gap",
      "label": "Private And Company Work Visibility Gap",
      "scope": "collected public repository evidence",
      "suggested_follow_up": "Ask which private or workplace projects best represent the same working behaviours.",
      "what_was_observed": "The reviewed corpus is public repository evidence and may omit private, company, or collaborative work that would materially change interpretation.",
      "why_uncertain": "The repository corpus is a public evidence sample and does not expose every work context."
    },
    {
      "confidence": "low",
      "gap_id": "gap-003-development_cadence_visibility_gap",
      "label": "Development Cadence Visibility Gap",
      "scope": "collected public repository evidence",
      "suggested_follow_up": "Ask the person to walk through a representative project timeline and explain major iteration points.",
      "what_was_observed": "Readable git chronology was unavailable or shallow, so public commit cadence cannot support a confident work-rhythm interpretation.",
      "why_uncertain": "The repository corpus is a public evidence sample and does not expose every work context."
    }
  ],